{
  "$schema": "https://json-schema.org/draft/2020-12/schema",
  "$id": "https://wefter.dev/schemas/product-shaping-contract.schema.json",
  "type": "object",
  "required": ["version", "workflowId", "defaultRoots", "vocabulary", "statusEnums", "dynamicCollections", "creationOrderScope", "creationOrder", "utilizationOrder", "precedence", "requiredFiles"],
  "properties": {
    "version": { "const": 1 },
    "workflowId": { "const": "product-shaping" },
    "defaultRoots": {
      "type": "object",
      "required": ["specRoot", "workflowRoot", "runRoot"],
      "properties": {
        "specRoot": { "const": ".wefter/specs" },
        "workflowRoot": { "const": ".wefter/workflows" },
        "runRoot": { "const": ".wefter/runs/product-shaping" }
      },
      "additionalProperties": false
    },
    "vocabulary": {
      "type": "array",
      "minItems": 5,
      "maxItems": 5,
      "prefixItems": [
        { "const": "idea" },
        { "const": "product specs" },
        { "const": "release" },
        { "const": "deliverable" },
        { "const": "task" }
      ],
      "items": false
    },
    "statusEnums": {
      "type": "object",
      "required": ["feature", "question", "decision", "deliverable"],
      "properties": {
        "feature": { "const": ["candidate", "core", "future", "rejected", "needs-decision"] },
        "question": { "const": ["open", "answered", "deferred", "obsolete"] },
        "decision": { "const": ["accepted", "superseded", "rejected"] },
        "deliverable": { "const": ["candidate", "ready", "blocked", "deferred", "done"] }
      },
      "additionalProperties": false
    },
    "dynamicCollections": {
      "type": "object",
      "required": ["references"],
      "properties": {
        "references": {
          "type": "object",
          "required": ["index", "itemPattern", "listingPattern", "creationOrder", "zeroItemsAllowedWithExplicitIndexStatement", "rule"],
          "properties": {
            "index": { "const": "references/README.md" },
            "itemPattern": { "const": "references/<reference>.md" },
            "listingPattern": { "const": "references/<reference>.md" },
            "creationOrder": { "type": "string", "minLength": 1 },
            "zeroItemsAllowedWithExplicitIndexStatement": { "const": true },
            "rule": { "type": "string", "minLength": 1 }
          },
          "additionalProperties": false
        }
      },
      "additionalProperties": false
    },
    "creationOrderScope": { "const": "fixed-required-files" },
    "creationOrder": { "$ref": "#/$defs/creationOrder" },
    "utilizationOrder": { "$ref": "#/$defs/utilizationOrder" },
    "precedence": {
      "type": "object",
      "required": ["release", "product", "decision", "blockingQuestionRule"],
      "properties": {
        "release": { "$ref": "#/$defs/pathList" },
        "product": { "$ref": "#/$defs/pathList" },
        "decision": { "type": "string", "minLength": 1 },
        "blockingQuestionRule": { "type": "string", "minLength": 1 }
      },
      "additionalProperties": false
    },
    "requiredFiles": {
      "type": "array",
      "minItems": 17,
      "maxItems": 17,
      "items": {
        "type": "object",
        "required": ["path", "responsibility", "limits", "createdAfter", "usedBefore", "consumers", "minimumContent", "hardRules"],
        "properties": {
          "path": { "$ref": "#/$defs/requiredFilePath" },
          "responsibility": { "type": "string", "minLength": 1 },
          "limits": { "type": "string", "minLength": 1 },
          "createdAfter": { "$ref": "#/$defs/pathList" },
          "usedBefore": { "$ref": "#/$defs/pathList" },
          "consumers": { "$ref": "#/$defs/stringList" },
          "minimumContent": { "$ref": "#/$defs/stringList" },
          "hardRules": { "$ref": "#/$defs/stringList" }
        },
        "additionalProperties": false
      },
      "allOf": [
        { "contains": { "type": "object", "required": ["path"], "properties": { "path": { "const": "README.md" } } } },
        { "contains": { "type": "object", "required": ["path"], "properties": { "path": { "const": "discovery/SOURCE_MATERIALS.md" } } } },
        { "contains": { "type": "object", "required": ["path"], "properties": { "path": { "const": "discovery/IDEA_BRIEF.md" } } } },
        { "contains": { "type": "object", "required": ["path"], "properties": { "path": { "const": "discovery/OPEN_QUESTIONS.md" } } } },
        { "contains": { "type": "object", "required": ["path"], "properties": { "path": { "const": "references/README.md" } } } },
        { "contains": { "type": "object", "required": ["path"], "properties": { "path": { "const": "PRODUCT_VISION.md" } } } },
        { "contains": { "type": "object", "required": ["path"], "properties": { "path": { "const": "product/FEATURE_CATALOG.md" } } } },
        { "contains": { "type": "object", "required": ["path"], "properties": { "path": { "const": "product/MODULE_ROADMAP.md" } } } },
        { "contains": { "type": "object", "required": ["path"], "properties": { "path": { "const": "product/DOMAIN_MODEL.md" } } } },
        { "contains": { "type": "object", "required": ["path"], "properties": { "path": { "const": "product/OPERATIONAL_FLOW.md" } } } },
        { "contains": { "type": "object", "required": ["path"], "properties": { "path": { "const": "product/PRODUCT_DECISIONS.md" } } } },
        { "contains": { "type": "object", "required": ["path"], "properties": { "path": { "const": "releases/README.md" } } } },
        { "contains": { "type": "object", "required": ["path"], "properties": { "path": { "const": "releases/<release-id>/README.md" } } } },
        { "contains": { "type": "object", "required": ["path"], "properties": { "path": { "const": "releases/<release-id>/SCOPE.md" } } } },
        { "contains": { "type": "object", "required": ["path"], "properties": { "path": { "const": "releases/<release-id>/DOMAIN_SPEC.md" } } } },
        { "contains": { "type": "object", "required": ["path"], "properties": { "path": { "const": "releases/<release-id>/ACCEPTANCE_CRITERIA.md" } } } },
        { "contains": { "type": "object", "required": ["path"], "properties": { "path": { "const": "releases/<release-id>/DELIVERABLES.md" } } } }
      ]
    }
  },
  "additionalProperties": false,
  "$defs": {
    "pathList": {
      "type": "array",
      "items": { "type": "string", "minLength": 1 }
    },
    "requiredFilePath": {
      "enum": [
        "README.md",
        "discovery/SOURCE_MATERIALS.md",
        "discovery/IDEA_BRIEF.md",
        "discovery/OPEN_QUESTIONS.md",
        "references/README.md",
        "PRODUCT_VISION.md",
        "product/FEATURE_CATALOG.md",
        "product/MODULE_ROADMAP.md",
        "product/DOMAIN_MODEL.md",
        "product/OPERATIONAL_FLOW.md",
        "product/PRODUCT_DECISIONS.md",
        "releases/README.md",
        "releases/<release-id>/README.md",
        "releases/<release-id>/SCOPE.md",
        "releases/<release-id>/DOMAIN_SPEC.md",
        "releases/<release-id>/ACCEPTANCE_CRITERIA.md",
        "releases/<release-id>/DELIVERABLES.md"
      ]
    },
    "creationOrder": {
      "type": "array",
      "minItems": 17,
      "maxItems": 17,
      "prefixItems": [
        { "const": "README.md" },
        { "const": "discovery/SOURCE_MATERIALS.md" },
        { "const": "discovery/IDEA_BRIEF.md" },
        { "const": "discovery/OPEN_QUESTIONS.md" },
        { "const": "references/README.md" },
        { "const": "PRODUCT_VISION.md" },
        { "const": "product/FEATURE_CATALOG.md" },
        { "const": "product/MODULE_ROADMAP.md" },
        { "const": "product/DOMAIN_MODEL.md" },
        { "const": "product/OPERATIONAL_FLOW.md" },
        { "const": "product/PRODUCT_DECISIONS.md" },
        { "const": "releases/README.md" },
        { "const": "releases/<release-id>/README.md" },
        { "const": "releases/<release-id>/SCOPE.md" },
        { "const": "releases/<release-id>/DOMAIN_SPEC.md" },
        { "const": "releases/<release-id>/ACCEPTANCE_CRITERIA.md" },
        { "const": "releases/<release-id>/DELIVERABLES.md" }
      ],
      "items": false
    },
    "utilizationOrder": {
      "type": "array",
      "minItems": 15,
      "maxItems": 15,
      "prefixItems": [
        { "const": "README.md" },
        { "const": "releases/<release-id>/README.md" },
        { "const": "PRODUCT_VISION.md" },
        { "const": "product/PRODUCT_DECISIONS.md" },
        { "const": "releases/<release-id>/SCOPE.md" },
        { "const": "releases/<release-id>/DOMAIN_SPEC.md" },
        { "const": "releases/<release-id>/ACCEPTANCE_CRITERIA.md" },
        { "const": "releases/<release-id>/DELIVERABLES.md" },
        { "const": "product/DOMAIN_MODEL.md" },
        { "const": "product/OPERATIONAL_FLOW.md" },
        { "const": "product/FEATURE_CATALOG.md" },
        { "const": "product/MODULE_ROADMAP.md" },
        { "const": "discovery/OPEN_QUESTIONS.md" },
        { "const": "discovery/IDEA_BRIEF.md" },
        { "const": "references/" }
      ],
      "items": false
    },
    "stringList": {
      "type": "array",
      "minItems": 1,
      "items": { "type": "string", "minLength": 1 }
    },
    "stringEnum": {
      "type": "array",
      "minItems": 1,
      "uniqueItems": true,
      "items": { "type": "string", "minLength": 1 }
    }
  }
}
